adult,backdrop_path,genre_ids,id,original_language,original_title,overview,popularity,poster_path,release_date,title,video,vote_average,vote_count
False,/7HKpc11uQfxnw0Y8tRUYn1fsKqE.jpg,"[878, 28, 53]",1236153,en,Mercy,"In the near future, a detective stands on trial accused of murdering his wife. He has ninety minutes to prove his innocence to the advanced AI Judge he once championed, before it determines his fate.",750.3963,/pyok1kZJCfyuFapYXzHcy7BLlQa.jpg,2026-01-20,Mercy,False,7.06,430
False,/hHDNOlATHhre4eZ7aYz5cdyJLik.jpg,"[27, 53, 878]",1272837,en,28 Years Later: The Bone Temple,Dr. Kelson finds himself in a shocking new relationship - with consequences that could change the world as they know it - and Spike's encounter with Jimmy Crystal becomes a nightmare he can't escape.,309.9832,/kK1BGkG3KAvWB0WMV1DfOx9yTMZ.jpg,2026-01-14,28 Years Later: The Bone Temple,False,7.226,568
False,/w1Z1I9PqTK5UjG6RVAFXLCjp1Sw.jpg,"[878, 28, 53]",434853,en,Space/Time,"After a fatal test shuts down their project, a disgraced team of scientists enters the criminal underworld to rebuild a forbidden space-bending engine that could rescue humanity or annihilate it entirely.",214.2447,/uje1ecKMnNpZp0at5TxlvVgVXqI.jpg,2025-05-01,Space/Time,False,5.7,33
False,/cugd16e3WbCG3Zogb8N7lwUnVXH.jpg,"[14, 28, 12]",1253000,en,Deathstalker,"A powerful swordsman known as Deathstalker recovers a cursed amulet from a corpse-strewn battlefield. Marked by dark magic and hunted by monstrous assassins, he must face the rising evil and break the curse.",234.3202,/nEI3DnzQC1afAjJOAizx6UX27pL.jpg,2025-10-10,Deathstalker,False,6.3,49
False,/u9jE0R1nvkmdWu3bt7Op8joPywa.jpg,"[12, 53, 878]",840464,en,Greenland 2: Migration,"Having found the safety of the Greenland bunker after the comet Clarke decimated the Earth, the Garrity family must now risk everything to embark on a perilous journey across the wasteland of Europe to find a new home.",223.2966,/z2tqCJLsw6uEJ8nJV8BsQXGa3dr.jpg,2026-01-07,Greenland 2: Migration,False,6.535,493
False,/uzZ7LUx4Bb3nZXjvBx5PiqTE7rk.jpg,[28],1301306,en,A Woman Scorned,"Jas and her sister Laura are interrupted on their family weekend break in the country side by a group of local men intent on terrorising them. When Laura is attacked and killed by the group, Jas discovers her lifeless body back at the cabin they've hired. She is instilled with grief, rage and fury and intent on hunting down and taking out the gang by whatever means necessary as justice for her sister's murder.",239.3872,/dlOSBiNULMPzKIze84LDjvEN9z1.jpg,2025-06-09,A Woman Scorned,False,5.5,8
False,,"[10749, 18]",1523145,ru,Твое сердце будет разбито,"High school student Polina is saved from bullying at her new school and makes a deal with the main bully Bars: he must pretend to be her boyfriend and protect her, and she must do everything he says. During this game, the couple develops real feelings, but her family and classmates have reasons to separate the lovers.",217.3668,/6qmhUBfGoII6PSNik0e35OgEK8g.jpg,2026-03-26,Your Heart Will Be Broken,False,0.0,0
False,/4IEjHlV6ciUPopHnEs5AfBNJ6XS.jpg,[28],1634858,es,Cuerno Azulado,,193.4481,/q0OveDlsh5BNq6ifZqNWKtLKiwb.jpg,2025-09-10,Cuerno Azulado,False,7.143,7
False,/zXINNssll2zsPGqd7F7Llrw7Uql.jpg,"[28, 80, 18, 53]",1419406,zh,捕风追影,Macau Police brings the tracking expert police officer out of retirement to help catch a dangerous group of professional thieves.,197.453,/e0RU6KpdnrqFxDKlI3NOqN8nHL6.jpg,2025-08-16,The Shadow's Edge,False,7.2,444
False,/7nfpkR9XsQ1lBNCXSSHxGV7Dkxe.jpg,"[16, 35, 12, 10751, 9648]",1084242,en,Zootopia 2,"After cracking the biggest case in Zootopia's history, rookie cops Judy Hopps and Nick Wilde find themselves on the twisting trail of a great mystery when Gary De'Snake arrives and turns the animal metropolis upside down. To crack the case, Judy and Nick must go undercover to unexpected new parts of town, where their growing partnership is tested like never before.",196.1509,/oJ7g2CifqpStmoYQyaLQgEU32qO.jpg,2025-11-26,Zootopia 2,False,7.6,1811
False,/cz4vLJrmaV1zJlRYbxqtvLzeLWB.jpg,"[28, 35, 80, 9648]",1168190,en,The Wrecking Crew,"Estranged half-brothers Jonny and James reunite after their father's mysterious death. As they search for the truth, buried secrets reveal a conspiracy threatening to tear their family apart.",163.0205,/gbVwHl4YPSq6BcC92TQpe7qUTh6.jpg,2026-01-28,The Wrecking Crew,False,6.921,658
False,/vSQSYd2zZTqc0zmHImwWEGGluMI.jpg,"[10749, 18]",1316092,en,“Wuthering Heights”,"Tragedy strikes when Heathcliff falls in love with Catherine Earnshaw, a woman from a wealthy family in 18th-century England.",141.2429,/ywRO5dyE8RyyXJd6cvd69jLZeic.jpg,2026-02-11,“Wuthering Heights”,False,6.5,333
False,/82lM4GJ9uuNvNDOEpxFy77uv4Ak.jpg,"[28, 878, 12]",1242898,en,Predator: Badlands,"Cast out from his clan, a young Predator finds an unlikely ally in a damaged android and embarks on a treacherous journey in search of the ultimate adversary.",156.9309,/erTRAi241eYF4K8KoGGOI8kFPox.jpg,2025-11-05,Predator: Badlands,False,7.72,2120
False,/tNONILTe9OJz574KZWaLze4v6RC.jpg,"[18, 9648, 53]",1368166,en,The Housemaid,"Trying to escape her past, Millie Calloway accepts a job as a live-in housemaid for the wealthy Nina and Andrew Winchester. But what begins as a dream job quickly unravels into something far more dangerous—a sexy, seductive game of secrets, scandal, and power.",144.8927,/cWsBscZzwu5brg9YjNkGewRUvJX.jpg,2025-12-18,The Housemaid,False,7.233,1262
False,/xzY15HIBMR1MPo9Me8OsaZShF9T.jpg,[28],1244975,fr,Les Orphelins,"Gab and Driss, childhood friends on bad terms since they left the orphanage, now have opposite lives - one is a cop with the IGPN, the other a fixer for thugs. When their first love dies in a suspicious accident, her 17-year-old daughter, Leïla, takes Gab's gun and sets off on the trail of a powerful organization willing to do anything to cover the case up. Forced to team up, the orphans must stop her before she crosses a line she can't return from...",248.527,/hP7mjZr2SVfjAorlRHTdV1XZmHY.jpg,2025-08-20,The Orphans,False,6.043,47
False,/thgemkoLauZxcqe6KX8wxqEc70z.jpg,"[53, 18]",1428862,es,Cortafuego,"Little Lide disappears in the forest while her family packs up their home. As a fire breaks out, her mother must race to reach her before the flames do.",106.049,/knh3c8LzL9fMhjc5SZPAOotXyiy.jpg,2026-02-19,Firebreak,False,6.107,28
False,/sdZSjtGUTSN8B3al5o0f2WoQfQQ.jpg,"[878, 12, 14]",83533,en,Avatar: Fire and Ash,"In the wake of the devastating war against the RDA and the loss of their eldest son, Jake Sully and Neytiri face a new threat on Pandora: the Ash People, a violent and power-hungry Na'vi tribe led by the ruthless Varang. Jake's family must fight for their survival and the future of Pandora in a conflict that pushes them to their emotional and physical limits.",127.8487,/bRBeSHfGHwkEpImlhxPmOcUsaeg.jpg,2025-12-17,Avatar: Fire and Ash,False,7.277,1807
False,/iZLqwEwUViJdSkGVjePGhxYzbDb.jpg,"[878, 53]",755898,en,War of the Worlds,"Will Radford is a top analyst for Homeland Security who tracks potential threats through a mass surveillance program, until one day an attack by an unknown entity leads him to question whether the government is hiding something from him... and from the rest of the world.",122.4948,/yvirUYrva23IudARHn3mMGVxWqM.jpg,2025-07-29,War of the Worlds,False,4.199,899
False,/ohUhHOqW8cM59Ay5UjqplLzJbH3.jpg,"[10749, 18]",1317672,en,Love Me Love Me,"After her brother's death, June moves to Milan for a fresh start, finding comfort in Will, the perfect honor student at her new international school. But when his troubled best friend James—hiding a dangerous life in clandestine MMA fights—sparks a rivalry that quickly turns into irresistible attraction, June must choose between safety and a love that upends everything she thought she wanted.",92.0857,/xmoO861IKm1ycJ52mLGc3nwINKV.jpg,2026-02-12,Love Me Love Me,False,5.748,123
False,/5arE7ysejlE2byGyakuUrR5TmUt.jpg,"[27, 53, 28]",1205225,en,Gates of Flesh,"A group of friends attempt to escape the city after an outbreak of demon-possessions. The friends seek shelter in an abandoned church, but their plans for escape are ruined when one of them becomes possessed.",120.687,/tsu0fapttpwweWhx2GvYFtSCFhi.jpg,2025-04-08,Gates of Flesh,False,6.611,18
False,/xcBlMEvzuaHoWANKYn5PGvcW4OC.jpg,"[27, 28, 53]",1110034,no,Kraken,"Marine biologist Johanne is doing research on a fish farm in Vangsnes, a rural community located by the fjord, when she encounters several strange occurrences. Along with the brutal deaths of two local teenagers, all signs point to the deep fjord; can there be more to the depths than the eye can see? At the bottom of the deepest fjord rests a mythical monster as large as a mountain, with a myriad of arms ready to crush and devour anything they can grab.",110.5038,/jVsflOu9WpMqUJ3WwVX2mITi86S.jpg,2026-02-06,Kraken,False,8.0,5
False,/1qwhYqg7YEZajh3Q4biqbuQoDq8.jpg,"[16, 35, 10751, 28]",1297842,en,GOAT,"Will, a small goat with big dreams, gets a once-in-a-lifetime shot to join the pros and play roarball – a high-intensity, co-ed, full-contact sport dominated by the fastest, fiercest animals in the world. Will's new teammates aren't thrilled about having a little goat on their roster, but Will is determined to revolutionize the sport and prove once and for all that 'smalls can ball'!",99.2385,/wfuqMlaExcoYiUEvKfVpUTt1v4u.jpg,2026-02-11,GOAT,False,7.4,60
False,/6D6M5z4reppUxo2cnBEKI02Csp1.jpg,"[28, 80, 53]",1601243,en,Oscar Shaw,"After retiring from the police force, a relentless detective haunted by the tragic loss of his closest friend sets out on a perilous quest for vengeance, seeking redemption and fighting to restore justice to the streets he once swore to protect.",96.2396,/tsE3nySukwrfUjouz8vzvKTcXNC.jpg,2026-01-09,Oscar Shaw,False,6.19,21
False,/9uakM2woks0JV8HKIc4oatIVS88.jpg,"[27, 53]",1315303,en,Primate,"Lucy, a college student, along with her friends, spend their vacation at her family's home in Hawaii, which includes her pet chimpanzee, Ben. However, when Ben contracts rabies after being bitten by a rabid animal, the group must fight for their lives in order to avoid the now-violent chimp.",87.669,/rKleYiEj4pFqxedTRWfujLooi84.jpg,2026-01-01,Primate,False,6.646,383
False,/1Xdsq7U7bvJJd2X7Jg4qNaKVkYO.jpg,"[28, 53, 80, 18]",1426964,pt,Salve Geral: Irmandade,"As São Paulo erupts in an unprecedented wave of violence, a lawyer with underworld ties must strike a deal with the police to rescue her kidnapped niece.",83.5232,/3Eaqedg8MAlnP51GYY8MCSIdTnV.jpg,2026-02-10,State of Fear,False,5.0,38
False,/bHtlDAORBQiYKCJMwDP9WBgcQHM.jpg,[18],1317288,en,Marty Supreme,"Marty Mauser, a young man with a dream no one respects, goes to hell and back in pursuit of greatness.",93.6353,/lYWEXbQgRTR4ZQleSXAgRbxAjvq.jpg,2025-12-19,Marty Supreme,False,7.554,918
False,/lNYympQM5O6QSInusbyG9eJDIe4.jpg,"[16, 28, 14]",1311031,ja,劇場版「鬼滅の刃」無限城編 第一章 猗窩座再来,"The Demon Slayer Corps are drawn into the Infinity Castle, where Tanjiro, Nezuko, and the Hashira face terrifying Upper Rank demons in a desperate fight as the final battle against Muzan Kibutsuji begins.",94.6832,/fWVSwgjpT2D78VUh6X8UBd2rorW.jpg,2025-07-18,Demon Slayer: Kimetsu no Yaiba Infinity Castle,False,7.668,731
False,/yWZc7ZglTAecVLKHS0oROuetKce.jpg,"[80, 53]",1171145,en,Crime 101,"When an elusive thief whose high-stakes heists unfold along the iconic 101 freeway in Los Angeles eyes the score of a lifetime, with hopes of this being his final job, his path collides with a disillusioned insurance broker who is facing her own crossroads. Determined to crack the case, a relentless detective closes in on the operation, raising the stakes even higher.",84.2924,/2HoR2x23bqKpopluoBD1FH3tBi7.jpg,2026-02-11,Crime 101,False,6.886,88
False,/15sarvi4KF6WFtCQbKgcxG8iOj.jpg,"[27, 53]",1146344,en,Misdirection,"A desperate couple have pulled off a string of high-end break-ins to pay off a mob debt. When they attempt to rob their latest victim, they find themselves caught in a deadly game of cat and mouse. The tables are turned and the hunters become the hunted.",85.519,/z7padnoIDHbmxPdqEHryhqlaVqc.jpg,2026-01-13,Misdirection,False,5.979,24
False,/wCwZ4ljSsWyZyTiyk1tGQtBHTDx.jpg,"[28, 18]",1511417,te,Bāhubali: The Epic,"When a mysterious child is found by a tribal couple near a roaring waterfall, they raise him as their own. As he grows, Sivudu is drawn to the world beyond the cliffs, where he discovers the ancient kingdom of Mahishmati, ruled by a cruel tyrant, haunted by rebellion, and bound to his past. What begins as a quest for love soon unravels a legacy of betrayal, sacrifice, and a forgotten prince.",80.9801,/z9YIo2qscyaXYgRqIdRJtND3bw8.jpg,2025-10-29,Bāhubali: The Epic,False,6.0,31
False,/eUERZRVjCTNdgnESlQxyaOJ2d4K.jpg,[28],1584215,en,The Internship,"A CIA-trained assassin recruits other graduates from her secret childhood program, The Internship, to violently destroy the organization. The CIA fights back with deadly force.",76.0536,/fYqSOkix4rbDiZW0ACNnvZCpT6X.jpg,2026-01-13,The Internship,False,6.3,49
False,/fIuuYkIjF9Q7W26YbIeKX5OWwiL.jpg,[18],1600028,es,La celda de los milagros,"After being falsely accused of a terrible crime, Hector, a man with a neurological disability, goes to a secret prison. His goodness conquers the prisoners, who plan to prove their innocence.",83.4738,/heC13pt4SV7y3HF5lWNzf0u729j.jpg,2025-12-25,A Father's Miracle,False,7.689,37
False,/gLXibzLQ4qegvjdqDC0f8yTij2P.jpg,"[9648, 53, 28]",1310568,en,Murder at the Embassy,"1934. Private detective Miranda Green investigates a murder perpetrated in the British Embassy in Cairo, where a top secret document was stolen, risking to jeopardize both Buckingham Palace and the peace of the world. All those present in this closed place are suspected: the American photographer, the English student, the American actress, the Egyptian security guard, the ambassador interpreter, the Egyptian gardener and - why not? — the Ambassador himself. But who would have expected that a small group of Nazis would be behind a plot, risking to jeopardize both Buckingham Palace and the peace of the world?",75.1376,/3DBmBItPdy0A2ol59jgHhS54Lua.jpg,2025-11-14,Murder at the Embassy,False,5.843,35
False,/swxhEJsAWms6X1fDZ4HdbvYBSf9.jpg,"[12, 35, 27, 28]",1234731,en,Anaconda,"A group of friends facing mid-life crises head to the rainforest with the intention of remaking their favorite movie from their youth, only to find themselves in a fight for their lives against natural disasters, giant snakes and violent criminals.",74.2932,/qxMv3HwAB3XPuwNLMhVRg795Ktp.jpg,2025-12-24,Anaconda,False,5.811,655
False,/3F2EXWF1thX0BdrVaKvnm6mAhqh.jpg,"[28, 53, 80]",1306368,en,The Rip,"Trust frays when a team of Miami cops discovers millions in cash inside a run-down stash house, calling everyone — and everything — into question.",77.1408,/4wsYWH73Hb1B6noGIFaRQSAkuXj.jpg,2026-01-13,The Rip,False,7.059,1240
False,/lAtuFCx6cYkNBmTMSNnLE0qlCLx.jpg,"[28, 80, 10749]",1271895,zh,96分鐘,"Former bomb disposal expert, Song Kang-Ren, and his fiancée, Huang Xin, board a high-speed train that contains a bomb. At the same time, Liu Kai, a well-known physics teacher who was involved in an affair scandal, also boards this same train in order to win back his wife, Ting Juan, who took the prior high-speed rail to return home in frustration…  After all, can the bomb be successfully defused this time? and resolve the crisis?",71.2881,/gWKZ1iLhukvLoh8XY2N4tMvRQ2M.jpg,2025-09-05,96 Minutes,False,5.911,56
False,/vHvVt2Lovn4G6of9u3pHEQE2CxI.jpg,"[27, 9648]",1323625,en,Night Patrol,An L.A. cop discovers a local task force is hiding a secret that puts the residents of his childhood neighborhood in danger.,76.1087,/rNqLzACU9ez2ehDalTFDPjZiC4G.jpg,2026-01-16,Night Patrol,False,4.5,20
False,/nLxoXMY7LnS8ymfNWusCV1wuK7V.jpg,"[27, 53]",1052558,en,iPossessed,"A group of celebrating friends make a pact with a demon to stay the night or someone loses their soul, only to find out the demons they are fighting might be the ones they carry inside.",69.417,/kmnaCRTinFPN8iplWgdGQZ52WzY.jpg,2025-01-15,iPossessed,False,6.2,10
False,/73BClq9FOcrWrutnpiqhCNEWEwJ.jpg,"[18, 10749, 36]",858024,en,Hamnet,"The powerful story of love and loss that inspired the creation of Shakespeare's timeless masterpiece, Hamlet.",78.1873,/vbeyOZm2bvBXcbgPD3v6o94epPX.jpg,2025-11-26,Hamnet,False,7.727,703
False,/oN4TQ1TxchynXlFiXFBL3NHLT54.jpg,"[16, 10751, 18]",1167307,en,David,"From the songs of his mother’s heart to the whispers of a faithful God, David’s story begins in quiet devotion. When the giant Goliath rises to terrorize a nation, a young shepherd armed with only a sling, a few stones, and unshakable faith steps forward. Pursued by power and driven by purpose, his journey tests the limits of loyalty, love, and courage—culminating in a battle not just for a crown, but for the soul of a kingdom.",63.1524,/bESlrLOrsQ9gKzaGQGHXKOyIUtX.jpg,2025-12-14,David,False,8.1,91
False,/oN4TQ1TxchynXlFiXFBL3NHLT54.jpg,"[16, 10751, 18]",1167307,en,David,"From the songs of his mother’s heart to the whispers of a faithful God, David’s story begins in quiet devotion. When the giant Goliath rises to terrorize a nation, a young shepherd armed with only a sling, a few stones, and unshakable faith steps forward. Pursued by power and driven by purpose, his journey tests the limits of loyalty, love, and courage—culminating in a battle not just for a crown, but for the soul of a kingdom.",63.1524,/bESlrLOrsQ9gKzaGQGHXKOyIUtX.jpg,2025-12-14,David,False,8.1,91
False,/dHSz0tSFuO2CsXJ1CApSauP9Ncl.jpg,"[53, 80, 9648]",425274,en,Now You See Me: Now You Don't,"The original Four Horsemen reunite with a new generation of illusionists to take on powerful diamond heiress Veronika Vanderberg, who leads a criminal empire built on money laundering and trafficking. The new and old magicians must overcome their differences to work together on their most ambitious heist yet.",59.9402,/oD3Eey4e4Z259XLm3eD3WGcoJAh.jpg,2025-11-12,Now You See Me: Now You Don't,False,6.527,1085
False,/AecGG1XVCmkk7fT10ko3FC0dLIP.jpg,"[14, 28, 53]",1043197,en,Dust Bunny,"Ten-year-old Aurora asks her hitman neighbor to kill the monster under her bed that she claims ate her family. To protect her, he must battle an onslaught of assassins while accepting that some monsters are real.",60.0587,/vobigFZFvbYPf6ElYJu07P9rH8C.jpg,2025-12-11,Dust Bunny,False,6.622,178
False,/gbjK8p5S1aLXWCwOoXqr9aWZvqG.jpg,"[16, 10751, 35, 12, 14]",991494,en,The SpongeBob Movie: Search for SquarePants,"Desperate to be a big guy, SpongeBob sets out to prove his bravery to Mr. Krabs by following The Flying Dutchman – a mysterious swashbuckling ghost pirate – on a seafaring adventure that takes him to the deepest depths of the deep sea, where no Sponge has gone before.",66.3427,/xJnOMMsFASxNiFnG7v3TNIQ3ife.jpg,2025-12-16,The SpongeBob Movie: Search for SquarePants,False,6.7,211
False,/okVPfrSx6RopERpOqMnVzpD50ey.jpg,"[27, 53]",241258,en,Incarnate,An exorcist comes up against an evil from his past when he uses his skills to enter the mind of a nine year old boy.,54.2032,/8j8PLnghBHpDEGfANNh8wc5cT4F.jpg,2016-12-01,Incarnate,False,5.451,592
False,/gQimJqYMKCkwHIo8wwYKhmnCfBr.jpg,"[28, 80, 53]",1242501,en,Icefall,"A young Indigenous game warden arrests an infamous poacher only to discover that the poacher knows the location of a plane carrying millions of dollars that has crashed in a frozen lake. When a group of criminals and dirty cops are alerted to the poacher’s whereabouts, the warden and the poacher team up to fight back and escape across the treacherous lake before the ice melts.",55.1766,/5Byv6nznAb2Izd0gHpODOXnuSbo.jpg,2025-10-16,Icefall,False,6.4,133
False,/pGFQCp12a8andfPlpnmXz44IIvY.jpg,"[878, 28, 12]",24428,en,The Avengers,"When an unexpected enemy emerges and threatens global safety and security, Nick Fury, director of the international peacekeeping agency known as S.H.I.E.L.D., finds himself in need of a team to pull the world back from the brink of disaster. Spanning the globe, a daring recruitment effort begins!",54.3753,/RYMX2wcKCBAr24UyPD7xwmjaTn.jpg,2012-04-25,The Avengers,False,7.949,36056
False,/oKKpryjqqKaohQe9SbnjyEhEVky.jpg,"[35, 18]",60238,en,Hidden Secrets,"A young man finds himself torn between his current girlfriend and an old flame at a friend's funeral, where lifestyles and attitudes clash over a long weekend.",51.0715,/mcMYNa3p8ZqFr8GuohQwTPdojnA.jpg,2006-10-06,Hidden Secrets,False,4.0,6
False,/tTDfDHqGkRgBTL4Tw8mU0iwkW8T.jpg,[27],1199869,en,Eye for an Eye,"Anna, grieving the sudden death of her parents, relocates from New York to a small Florida town to live with the grandmother she has never met. Isolated, vulnerable, and in need of friends, she finds brief solace in the company of two local teens. But when she becomes complicit to their unforgivable act of violence, she finds herself ensnared by Mr. Sandman – the twisted soul of a tormented child who haunts bullies’ dreams before feasting on their eyeballs when they finally wake - Anna must right her wrong before becoming a victim of this gruesome curse.",57.4466,/lpepbfVziHJLhVoxTEKs8ok00iu.jpg,2025-07-03,Eye for an Eye,False,5.613,31
False,/6YjnTRBz704LF1uJ3ZC4wsS9T8r.jpg,"[28, 80, 53]",1290821,en,Shelter,"A man living in self-imposed exile on a remote island rescues a young girl from a violent storm, setting off a chain of events that forces him out of seclusion to protect her from enemies tied to his past.",52.853,/buPFnHZ3xQy6vZEHxbHgL1Pc6CR.jpg,2026-01-28,Shelter,False,7.3,52
False,/AupBUhnJEFedxF4vQ82LU9rOXDC.jpg,"[16, 18, 10751, 14]",587370,cs,Pohádky po babičce,"Tom (4 years old), Suzanne (8) and Derek (10) spend the weekend with their grandparents. But nothing is as usual: Grandpa seems to be elsewhere; Tom wonders where Grandma has gone, she who always tells him incredible stories; Derek is hard at work renovating the old apple tree hut. So following in the footsteps of her ancestor, Suzanne improvises herself as a storyteller to illuminate the house with imaginary and wonderful stories and try to fill the absence of Grandmother. The movie is an adaptation of three tales written by Arnost Goldflam.",51.8333,/6LZJKktqh9jTL27vMU6oxzdvB3W.jpg,2025-11-06,Tales from the Magic Garden,False,5.0,5
False,/kuxLjp8ufk066O5YyNU116iVku7.jpg,"[18, 80]",48838,en,London Boulevard,A parolee falls for a reclusive movie star while trying to evade a ruthless gangster.,47.61,/naQKmThKMtlur92CDgCP6b9aoQE.jpg,2010-11-10,London Boulevard,False,5.892,799
False,/ez8EB8pWGZYDWx9OEVqDR5r9hQc.jpg,"[27, 53]",1503900,en,Die'ced: Reloaded,"Benny escapes an asylum on Halloween, masked as a scarecrow and hungry for blood. In 1980s Seattle, the hunt is on - and no one is safe.",46.0261,/haFDZfpKszHq7DXvuQd5Zz7shQW.jpg,2025-08-08,Die'ced: Reloaded,False,5.389,9
False,/atvDTVtj88v2YEjwZ20Jsr0P8nk.jpg,"[18, 53]",1193128,ar,قضية الغرباء,"A Syrian doctor and her daughter flee Aleppo, setting off a chain of events that binds five strangers together. A smuggler, a soldier, a poet, and a coast guard captain collide in a crisis that tests their courage, their choices, and their humanity.",56.7326,/RBIrEveMOIy5Kxg2WzgMnCIhaN.jpg,2025-12-31,I Was a Stranger,False,6.375,8
False,/r33gYNIvKen1ocWBsAwg8avGjwH.jpg,[18],220493,en,Sal,"James Franco's Sal chronicles the final hours of the life of actor Sal Mineo, one-time teen idol and star of the blockbuster films Rebel Without a Cause and Exodus.",47.7678,/v1AhGdqmaMC0354q2oVHCgH3d6z.jpg,2013-11-01,Sal,False,3.471,17
False,/nIh7npgLTsZyBl7TQpibZsz4hQH.jpg,[18],284276,en,Cake,"After having visions of a member of her support group who killed herself, a woman who also suffers with chronic pain seeks out the widower of the suicide.",45.4225,/5GJEZovjtKisJxNMG6fBTCxNzZi.jpg,2014-09-07,Cake,False,6.27,927
False,/be5SIsRGMckO8tU9lrLcIik70Dy.jpg,"[27, 14, 10749]",1246049,fr,Dracula,"In late 15th-century Eastern Europe, Prince Vlad II’s bride is brutally murdered. As a result, he renounces God and damns Heaven itself. Cursed with eternal life, Vlad is reborn as Dracula, an immortal warlord who defies fate in a blood-soaked crusade to wrench his lost love back from death.",48.9588,/libhghrUSBSEdHgF9uP1SQES0nQ.jpg,2025-07-30,Dracula,False,7.137,874
False,/vMxOmgmBGegjVObjlb8ugsjGgkD.jpg,"[10752, 28, 18]",1252037,de,Der Tiger,"A German Tiger tank crew is sent on a dangerous mission to rescue the missing officer Paul von Hardenburg from a top-secret bunker behind enemy lines. As they make their way through the lethal no-man's land, they must confront not only the enemy, but also their own fears and inner demons. Fueled by the Wehrmacht's methamphetamine, their mission increasingly becomes a journey into the heart of darkness.",51.786,/65Jr1JAgWlu9em8zHhAfrNJJQBt.jpg,2025-09-18,The Tank,False,7.089,347
False,/w3Bi0wygeFQctn6AqFTwhGNXRwL.jpg,"[14, 10402, 35, 16]",803796,en,KPop Demon Hunters,"When K-pop superstars Rumi, Mira and Zoey aren't selling out stadiums, they're using their secret powers to protect their fans from supernatural threats.",48.8123,/zT7Lhw3BhJbMkRqm9Zlx2YGMsY0.jpg,2025-06-20,KPop Demon Hunters,False,8.083,2416
False,/hO2jx1H3XafR7Y8QbFgVH1sHTY9.jpg,"[27, 53, 35]",1198994,en,Send Help,"Two colleagues become stranded on a deserted island, the only survivors of a plane crash. On the island, they must overcome past grievances and work together to survive, but ultimately, it's a battle of wills and wits to make it out alive.",47.7702,/kL4MgAIZIYX3sCeG34N0XfVhCtt.jpg,2026-01-22,Send Help,False,7.1,314
